,sentence
0,well the mother is washin(g) dishes and she hasn't turned the water off .
1,and the water (i)s spillin(g) out from the sink onto the floor and she's standin(g) in the puddle of water .
2,"and the boy is standin(g) on a stool , a high stool and he is robbing the cookie jar ."
3,and at the same time his sister is askin(g) him for a cookie and in the process his stool is starting to tip over .
4,and I guess that's the main point to this .
5,it looks like that boy (i)s in for a bad fall .
6,goin(g) to be in for a bad fall .
